{
  "id": "item-place-40",
  "title": "超写实3D游戏角色怀旧场景",
  "content": "超写实的 3D 渲染画面：2008 年风格即时战略游戏的女主角「薇拉」，红色军装外套配贝雷帽，完全依照想象中的原版建模复刻。场景是昏暗杂乱的 2008 年代卧室：零食包装袋、汽水罐、游戏海报、纠缠在一起的电线。角色坐在地毯上，面对一台正在播放老游戏过场动画的显像管电视，手边是有线游戏手柄。她被抓拍到转头的一瞬，回眸看向镜头，标志性的空灵面容带着一抹纯真微笑，上半身微微扭转、动态自然。怀旧低饱和色调，轻微胶片颗粒，3:2 横构图。",
  "language": "zh",
  "author": {
    "name": "LaplaceYoung"
  },
  "sourceLink": "https://github.com/LaplaceYoung/awesome-gpt-image-2.5/blob/main/docs/cases/040-imported-3d.md",
  "thumbnail": "https://assets.renoise.ai/static/seo/showcase/gpt-image-2.5/gpt25-laplace-40.webp",
  "featured": false,
  "tags": []
}
