{
  "id": "post-apocalyptic-city-with-green-vegetation",
  "title": "Post-Apocalyptic City with Green Vegetation",
  "content": "废土风：一张废土城市的照片，画面中充满了绿色的植被，细节非常丰富，地址为中国深圳。",
  "language": "zh",
  "author": {
    "name": "兔妹_兔子",
    "link": "https://x.com/tuzi_ai"
  },
  "sourceLink": "https://x.com/tuzi_ai/status/2097428055287316898",
  "sourcePublishedAt": "2026-09-08",
  "thumbnail": "https://assets.renoise.ai/static/seo/showcase/gpt-image-2.5/2097428055287316898.webp",
  "featured": false,
  "tags": [
    "Style & Intelligence"
  ]
}
