{
  "id": "vertical-iphone-lifestyle-portrait",
  "title": "Vertical iPhone Lifestyle Portrait",
  "content": "9:16 竖版，真实 iPhone 手机随手拍摄的生活感女性照片，画面主体是一位视觉年龄约 20–26",
  "language": "zh",
  "author": {
    "name": "李岳",
    "link": "https://x.com/liyue_ai"
  },
  "sourceLink": "https://x.com/liyue_ai/status/2097225500976443426",
  "sourcePublishedAt": "2026-09-08",
  "thumbnail": "https://assets.renoise.ai/static/seo/showcase/gpt-image-2.5/2097225500976443426.webp",
  "featured": false,
  "tags": [
    "Style & Intelligence"
  ]
}
