{
  "id": "item-lace-124",
  "title": "雨天清晨的仓鼠玻璃艺术",
  "content": "创作一幅梦幻般的竖版故事书插画，采用反向绘制的彩色玻璃风格，具有半透明的层次感、精细的金色花丝轮廓、柔和的水彩质感以及明亮的反光。画面展示了 {argument name=\"character\" default=\"一只睡眼惺忪的圆滚滚仓鼠\"} 在雨天清晨醒来，躺在深陷的奶油色绗缝床上，身旁是一扇高大的古老窗户；仓鼠有着棕白相间的毛发，小爪子搭在毯子上，粉嫩的鼻子，乌黑发亮的眼睛，正困倦地眨着眼。窗外是雨水冲刷过的朦胧蓝灰色欧洲哥特式城市，有着陡峭的屋顶、塔楼、温暖的黄色灯光、雾气和风暴云。室内采用温馨的天体主题：蓬松的奶油色被子上绣着金色的星星和新月，点缀着蓝色拼布，仓鼠身边塞着一只毛绒小羊，温暖的灯光与寒冷的雨天室外形成对比。在窗户附近的空中包含 3 条半透明的玻璃鱼：右侧中心偏大的一条，左下角一条小的，以及大鱼下方一条极小的。在鱼之间包含 5 个漂浮的小玻璃气泡和 1 颗发光的玻璃星星。添加 2 个水晶球：左侧悬挂着一个装有精致金枝的大球，右侧桌面上摆放着一个装有新月和星星的球。右上角添加 1 条悬挂的新月水晶装饰链。右侧窗台上摆放着精致的白花，左下角前景处有模糊的深色叶片植物。色调应为 {argument name=\"color palette\" default=\"朦胧的粉蓝色、珍珠奶油色、柔和的金色和温暖的琥珀色\"}；光影应呈现出 {argument name=\"mood\" default=\"宁静的雨天黎明，温馨而神奇\"} 的感觉。使用竖版 {argument name=\"aspect ratio\" default=\"2:3\"} 构图，高度细节化，带有闪烁的玻璃高光，柔和的景深，无文字，无水印。",
  "language": "zh",
  "author": {
    "name": "LaplaceYoung"
  },
  "sourceLink": "https://github.com/LaplaceYoung/awesome-gpt-image-2.5/blob/main/docs/cases/124-imported-.md",
  "thumbnail": "https://assets.renoise.ai/static/seo/showcase/gpt-image-2.5/gpt25-laplace-124.webp",
  "featured": false,
  "tags": []
}
