{
  "id": "dolphins-view-of-women-in-glass-aquarium",
  "title": "Dolphin's View of Women in Glass Aquarium",
  "content": "女性だけが入館できる連日大賑わいのイルカと泳げる水族館。館側のサービスで360°ガラス張りの水槽で泳ぎに来た女性達を待ち構え水槽から覗き込むイルカ。イルカ視点のリアルな画像",
  "language": "ja",
  "author": {
    "name": "こやす69＠AIプロンプト屋",
    "link": "https://x.com/AI_money_club"
  },
  "sourceLink": "https://x.com/AI_money_club/status/2096434210726662386",
  "sourcePublishedAt": "2026-09-06",
  "thumbnail": "https://assets.renoise.ai/static/seo/showcase/gpt-image-2.5/2096434210726662386.webp",
  "featured": false,
  "tags": [
    "Style & Intelligence"
  ]
}
