{
  "id": "item-place-56",
  "title": "物理破坏效果卡片",
  "content": "一幅超写实、电影感的插画：原创女冒险家「艾拉·石心」动态撞破一张「古墓探险」集换式卡牌的边框。她正处于绳索摆荡中，身穿冒险装备，双枪枪口的火焰震碎卡牌古老的石雕边框，破口周围产生可见的维度破裂效果——能量裂纹与空间扭曲，灰尘碎片四散飞溅。她的身体前冲带有明显的运动深度，突破卡牌平面；卡牌内部背景描绘茂密丛林遗迹与布满陷阱的古墓。卡牌碎屑、碎石、藤蔓和古钱币飞出卡外，散落在写实的木质桌面上，12:7 横版。",
  "language": "zh",
  "author": {
    "name": "LaplaceYoung"
  },
  "sourceLink": "https://github.com/LaplaceYoung/awesome-gpt-image-2.5/blob/main/docs/cases/056-imported-.md",
  "thumbnail": "https://assets.renoise.ai/static/seo/showcase/gpt-image-2.5/gpt25-laplace-56.webp",
  "featured": false,
  "tags": []
}
