{
  "id": "item-place-41",
  "title": "创意丝绸宇宙",
  "content": "将❄️雪花 emoji 变成一个柔软的 3D 丝绸质感物体：整个表面包裹着顺滑流动的丝绸面料，带有超现实的褶皱细节、柔和的高光与阴影。物体轻轻漂浮在干净的浅灰色背景中央，营造轻盈优雅的氛围。整体风格超现实、触感十足且现代，传递舒适与精致趣味。工作室灯光，高分辨率渲染，1:1。",
  "language": "zh",
  "author": {
    "name": "LaplaceYoung"
  },
  "sourceLink": "https://github.com/LaplaceYoung/awesome-gpt-image-2.5/blob/main/docs/cases/041-imported-.md",
  "thumbnail": "https://assets.renoise.ai/static/seo/showcase/gpt-image-2.5/gpt25-laplace-41.webp",
  "featured": false,
  "tags": []
}
