{
  "id": "low-angle-fashion-study",
  "title": "Low-angle fashion study",
  "content": "Create a dramatic cinematic low-angle photorealistic fashion portrait of a clearly adult woman, around 28 years old, seated confidently in a dark brown leather armchair inside an elegant private study.\nCAMERA: extreme low-angle fashion-editorial viewpoint from near floor level, looking upward. Wide-angle cinematic feel, realistic anatomy.\nENVIRONMENT: dark wood paneling, bookshelves, warm table lamp, brass details, traditional rug, leather armchair with nailhead trim.\nLIGHTING: warm cinematic indoor lighting, soft golden key, amber practicals, subtle rim on hair.\nSTYLE: high-end fashion editorial, realistic skin texture, detailed satin and leather. No text, no watermark.",
  "language": "en",
  "author": {
    "name": "LaplaceYoung"
  },
  "sourceLink": "https://github.com/LaplaceYoung/awesome-gpt-image-2.5",
  "thumbnail": "https://assets.renoise.ai/static/seo/showcase/gpt-image-2.5/gpt25-lab-low-angle-fashion.webp",
  "featured": false,
  "tags": [
    "fashion",
    "editorial",
    "low-angle"
  ]
}
