{
  "id": "square-blue-white-phone-and-cards-layout",
  "title": "Square Blue-White Phone and Cards Layout",
  "content": "正方形, 青×白, スマホ1台, 画像カード3枚, 日本語タイトル, 広い余白, 追加文字なし",
  "language": "ja",
  "author": {
    "name": "ゆーすけ｜ITエンジニア",
    "link": "https://x.com/ai_yusuke206"
  },
  "sourceLink": "https://x.com/ai_yusuke206/status/2097626070027546879",
  "sourcePublishedAt": "2026-09-09",
  "thumbnail": "https://assets.renoise.ai/static/seo/showcase/gpt-image-2.5/2097626070027546879.webp",
  "featured": false,
  "tags": [
    "Layout & Typography"
  ]
}
