{
  "id": "item-place-77",
  "title": "玩具盒中的国家立体模型",
  "content": "一张超写实的俯拍摄影作品：两只手撑开一个米色纸板盒的盒盖，盒内是 3D 打印的「中国」微缩立体模型——长城蜿蜒、黄土高原梯田、江南水乡、上海天际线、大熊猫栖息的竹林，以及大量微小精细的人物模型。全部采用触感舒适的玩具风格，哑光 3D 打印纹理并带可见的打印层纹。盒盖内侧用大号、色彩鲜艳的凸起塑料字母显示「CHINA」。光线温暖且具电影感，突出纹理与阴影。",
  "language": "zh",
  "author": {
    "name": "LaplaceYoung"
  },
  "sourceLink": "https://github.com/LaplaceYoung/awesome-gpt-image-2.5/blob/main/docs/cases/077-imported-.md",
  "thumbnail": "https://assets.renoise.ai/static/seo/showcase/gpt-image-2.5/gpt25-laplace-77.webp",
  "featured": false,
  "tags": []
}
