{
  "id": "item-lace-117",
  "title": "电影感沙漠“火之环”专辑封面",
  "content": "超写实电影感专辑封面，描绘了一位男歌手独自站在夜晚广阔荒凉的沙漠中央，身穿一件在风中自然飘动的黑色长风衣，搭配深色靴子和极简配饰。歌手直视镜头，表情冷静却充满强烈的情感。在他身后，一个巨大的圆形结构正在缓慢燃烧，在黑暗中形成一个巨大的火环，完美地置于他身后，宛如象征性的光环。火焰以强烈的暖橙色光芒照亮了他的轮廓边缘，而冷蓝色的月光则照亮了他脸部的另一侧，营造出极具戏剧性的电影感对比。浓烟升入夜空，发光的余烬在空中飘浮，微风吹动着他的衣物，地面呈现出沙漠的质感，远处的山脉在朦胧的大气中隐约可见。整体画面象征着毁灭、重生、自由与情感的蜕变。史诗般的另类摇滚专辑美学，极具艺术感且真实，充满强有力的象征意义，戏剧性的广角构图，歌手始终是视觉焦点。超精细的面部特征，真实的皮肤质感，自然的火焰反射，体积烟雾，电影级布光，细腻的模拟胶片颗粒感，丰富的阴影层次，使用 Canon EOS R5 和 35mm 电影镜头拍摄，超写实，高端音乐摄影，8K 分辨率，1:1 正方形专辑封面，无文字，无字母，无水印，非奇幻风格插画，无畸形解剖结构，无多余肢体。超写实电影感专辑封面，描绘了一位女歌手独自站在夜晚广阔荒凉的沙漠中央，身穿一件在风中自然飘动的黑色长风衣，搭配深色靴子和极简配饰。歌手直视镜头，表情冷静却充满强烈的情感。在她身后，一个巨大的圆形结构正在缓慢燃烧，在黑暗中形成一个巨大的火环，完美地置于她身后，宛如象征性的光环。火焰以强烈的暖橙色光芒照亮了她的轮廓边缘，而冷蓝色的月光则照亮了她脸部的另一侧，营造出极具戏剧性的电影感对比。浓烟升入夜空，发光的余烬在空中飘浮，微风吹动着她的衣物，地面呈现出沙漠的质感，远处的山脉在朦胧的大气中隐约可见。整体画面象征着毁灭、重生、自由与情感的蜕变。史诗般的另类摇滚专辑美学，极具艺术感且真实，充满强有力的象征意义，戏剧性的广角构图，歌手始终是视觉焦点。超精细的面部特征，真实的皮肤质感，自然的火焰反射，体积烟雾，电影级布光，细腻的模拟胶片颗粒感，丰富的阴影层次，使用 Canon EOS R5 和 35mm 电影镜头拍摄，超写实，高端音乐摄影，8K 分辨率，1:1 正方形专辑封面，无文字，无字母，无水印，非奇幻风格插画，无畸形解剖结构，无多余肢体。",
  "language": "zh",
  "author": {
    "name": "LaplaceYoung"
  },
  "sourceLink": "https://github.com/LaplaceYoung/awesome-gpt-image-2.5/blob/main/docs/cases/117-imported-.md",
  "thumbnail": "https://assets.renoise.ai/static/seo/showcase/gpt-image-2.5/gpt25-laplace-117.webp",
  "featured": false,
  "tags": []
}
