{
  "id": "nine-emoji-stickers-with-text",
  "title": "Nine Emoji Stickers with Text",
  "content": "参考图片人物，生成3*3共9种不同表情包，可以出现中文和英文，浅色渐变背景",
  "language": "zh",
  "author": {
    "name": "DeepBlue深藍",
    "link": "https://x.com/DeepBlueX0"
  },
  "sourceLink": "https://x.com/DeepBlueX0/status/2097611216139235779",
  "sourcePublishedAt": "2026-09-09",
  "thumbnail": "https://assets.renoise.ai/static/seo/showcase/gpt-image-2.5/2097611216139235779.webp",
  "featured": false,
  "tags": [
    "Reference Fidelity"
  ]
}
