{
  "id": "emoji-145",
  "title": "Emoji 簇绒地毯",
  "content": "创建一张图像：一块彩色手工簇绒地毯，形状为🦖恐龙 emoji，铺设在简约的木地板上。地毯设计大胆俏皮，柔软蓬松的质感配粗线条细节，绿色为主、奶白点缀。从上方俯拍，自然光照，整体风格略带古怪的 DIY 手作美感——类似手工簇绒艺术地毯，边缘绒线微微翘起。",
  "language": "zh",
  "author": {
    "name": "LaplaceYoung"
  },
  "sourceLink": "https://github.com/LaplaceYoung/awesome-gpt-image-2.5/blob/main/docs/cases/046-imported-emoji.md",
  "thumbnail": "https://assets.renoise.ai/static/seo/showcase/gpt-image-2.5/gpt25-laplace-46.webp",
  "featured": false,
  "tags": []
}
