{
  "id": "item-place-83",
  "title": "个性化房间设计",
  "content": "为我生成一间理想房间设计：床、书架、沙发、绿植、电脑桌和双屏电脑，墙上挂着三幅插画，窗外是城市夜景与远处霓虹。可爱 3D 风格，C4D 渲染，等距轴测图，柔和室内灯光与暖色点缀，细节丰富但构图干净。",
  "language": "zh",
  "author": {
    "name": "LaplaceYoung"
  },
  "sourceLink": "https://github.com/LaplaceYoung/awesome-gpt-image-2.5/blob/main/docs/cases/083-imported-.md",
  "thumbnail": "https://assets.renoise.ai/static/seo/showcase/gpt-image-2.5/gpt25-laplace-83.webp",
  "featured": false,
  "tags": []
}
