{
  "id": "zen-woman-by-water-in-summer",
  "title": "Zen Woman by Water in Summer",
  "content": "主题方向：东方禅意极简插画\n风格分支：女性审美清爽型\n主体内容：一位女子坐在水边石阶上，低头看向水面\n情绪母题：清新、夏日、松弛感\n场景与意象：青瓷蓝水面、白色石阶、柠檬黄色圆形日光、少量竹影、人物\n构图与空间：9:16",
  "language": "zh",
  "author": {
    "name": "李岳",
    "link": "https://x.com/liyue_ai"
  },
  "sourceLink": "https://x.com/liyue_ai/status/2096838519918596234",
  "sourcePublishedAt": "2026-09-07",
  "thumbnail": "https://assets.renoise.ai/static/seo/showcase/gpt-image-2.5/2096838519918596234.webp",
  "featured": false,
  "tags": [
    "Style & Intelligence"
  ]
}
