{
  "id": "portrait-of-woman-with-glasses",
  "title": "Portrait of Woman with Glasses",
  "content": "Portrait of a young East Asian woman with long, slightly wavy dark brown hair and soft bangs falling over her forehead. She wears thin gold round wire-frame glasses. She looks directly at the camera with large dark eyes, a calm,",
  "language": "en",
  "author": {
    "name": "Feyber",
    "link": "https://x.com/woleswoosh"
  },
  "sourceLink": "https://x.com/woleswoosh/status/2097173083400630755",
  "sourcePublishedAt": "2026-09-08",
  "thumbnail": "https://assets.renoise.ai/static/seo/showcase/gpt-image-2.5/2097173083400630755.webp",
  "featured": false,
  "tags": [
    "Style & Intelligence"
  ]
}
