{
  "id": "item-place-21",
  "title": "磨砂玻璃后的虚实对比剪影",
  "content": "一张黑白照片：一只柯基犬在磨砂玻璃后的模糊剪影。它紧贴玻璃的鼻尖与一只立起的耳朵轮廓格外清晰，与其余朦胧虚化的身形形成鲜明对比。背景为柔和的灰色渐变色调，增强神秘与艺术氛围，3:2 横构图。",
  "language": "zh",
  "author": {
    "name": "LaplaceYoung"
  },
  "sourceLink": "https://github.com/LaplaceYoung/awesome-gpt-image-2.5/blob/main/docs/cases/021-imported-.md",
  "thumbnail": "https://assets.renoise.ai/static/seo/showcase/gpt-image-2.5/gpt25-laplace-21.webp",
  "featured": false,
  "tags": []
}
