{
  "id": "police-heavy-machinery-unit-robots-cleaning-river",
  "title": "Police Heavy Machinery Unit Robots Cleaning River",
  "content": "『警視庁重機対策課ロボット隊』\n\n　川を堰き止めている\n　　ゴミを片付けています。",
  "language": "ja",
  "author": {
    "name": "カーブミラー",
    "link": "https://x.com/kabumira862571"
  },
  "sourceLink": "https://x.com/kabumira862571/status/2096948031438688526",
  "sourcePublishedAt": "2026-09-07",
  "thumbnail": "https://assets.renoise.ai/static/seo/showcase/gpt-image-2.5/2096948031438688526.webp",
  "featured": false,
  "tags": [
    "Style & Intelligence"
  ]
}
