{
  "id": "emoji-143",
  "title": "Emoji 奶油雪糕",
  "content": "生成图片：将🍓变成一根奶油雪糕，奶油在雪糕顶部呈丝滑曲线流动，看起来美味可口，45° 悬浮在空中，Q 版 3D 可爱风格，与草莓色系一致的纯色背景，柔和影棚光，1:1。",
  "language": "zh",
  "author": {
    "name": "LaplaceYoung"
  },
  "sourceLink": "https://github.com/LaplaceYoung/awesome-gpt-image-2.5/blob/main/docs/cases/044-imported-emoji.md",
  "thumbnail": "https://assets.renoise.ai/static/seo/showcase/gpt-image-2.5/gpt25-laplace-44.webp",
  "featured": false,
  "tags": []
}
