{
  "id": "banana-mascot-holding-oversized-can",
  "title": "Banana Mascot Holding Oversized Can",
  "content": "oversized cold aluminum can held forward toward camera by the running banana mascot",
  "language": "en",
  "author": {
    "name": "Loriel.AI",
    "link": "https://x.com/ou_zhen599"
  },
  "sourceLink": "https://x.com/ou_zhen599/status/2096263504454128117",
  "sourcePublishedAt": "2026-09-05",
  "thumbnail": "https://assets.renoise.ai/static/seo/showcase/gpt-image-2.5/2096263504454128117.webp",
  "featured": false,
  "tags": [
    "Style & Intelligence"
  ]
}
