{
  "id": "elegant-lake-como-wedding-invitation",
  "title": "Elegant Lake Como Wedding Invitation",
  "content": "An overhead flat lay photo of an elegant wedding invitation on heavy, textured ivory paper with deckled edges. The design features elaborate gold foil baroque framing with cherubs, lions, a crown, and a vintage Lake Como illustration at the bottom. Text on the invitation reads verbatim: 'TOGETHER WITH THEIR FAMILIES', 'Amelia Rose', '&', 'Ethan James', 'REQUEST THE HONOR OF YOUR PRESENCE AT THEIR MARRIAGE', 'SATURDAY, THE FOURTEENTH OF JUNE TWO THOUSAND TWENTY-FIVE AT FIVE O'CLOCK IN THE EVENING', 'Villa Eterna LAKE COMO, ITALY', and 'DINNER, DANCING, AND A LIFETIME OF LOVE TO FOLLOW'. Styled with a sage-green velvet ribbon containing the gold text 'A LOVE MORE BEAUTIFUL THAN TIME', a gold wax seal, white roses, and antique gold accessories. Soft, warm natural lighting emphasizing the rich metallic textures.",
  "language": "en",
  "author": {
    "name": "OpenAI"
  },
  "sourceLink": "https://openai.com/index/introducing-chatgpt-images-2-5/",
  "thumbnail": "https://assets.renoise.ai/static/seo/showcase/gpt-image-2.5/gpt25-official-atlas-gi25_011.webp",
  "featured": false,
  "tags": [
    "Layout & Typography",
    "official"
  ]
}
